"id","title","author","pub_date","venue","volume","issue","page","type","publisher","editor"
"doi:10.1007/978-3-319-54627-8_5 meta:br/0601","A Simplified Agile Methodology For Ontology Development","Peroni, Silvio [meta:ra/0601]","2017","Lecture Notes In Computer Science [meta:br/06010]","","","55-69","book chapter","Springer International Publishing [crossref:297 meta:ra/0602]",""
"doi:10.3233/ds-170012 meta:br/0602","Automating Semantic Publishing","Peroni, Silvio [orcid:0000-0003-0530-4305 meta:ra/0603]","2017-12-08","Data Science [issn:2451-8492 issn:2451-8484 meta:br/06011]","1","1-2","155-173","journal article","Ios Press [crossref:7437 meta:ra/0604]","Dumontier, Michel [orcid:0000-0003-4727-9435 meta:ra/0605]"
"doi:10.1145/1600193.1600232 meta:br/0603","Annotations With EARMARK For Arbitrary, Overlapping And Out-Of Order Markup","Peroni, Silvio [meta:ra/0606]; Vitali, Fabio [orcid:0000-0002-7562-5203 meta:ra/0607]","","","","","","proceedings article","",""
"doi:10.1016/j.websem.2012.08.001 meta:br/0604","FaBiO And CiTO: Ontologies For Describing Bibliographic Resources And Citations","Peroni, Silvio [meta:ra/0608]; Shotton, David [meta:ra/0609]","2012-12","Journal Of Web Semantics [issn:1570-8268 meta:br/06014]","17","","33-43","journal article","Elsevier Bv [crossref:78 meta:ra/06010]",""
"doi:10.1007/978-3-319-25639-9_35 meta:br/0605","Templating The Semantic Web Via RSLT","Peroni, Silvio [meta:ra/06011]; Vitali, Fabio [meta:ra/06012]","2015","The Semantic Web: ESWC 2015 Satellite Events [meta:br/06016]","","","183-189","book chapter","Springer International Publishing [crossref:297 meta:ra/0602]",""
"doi:10.1016/j.websem.2017.06.001 meta:br/0606","Interfacing Fast-Fashion Design Industries With Semantic Web Technologies","Peroni, Silvio [meta:ra/06013]; Vitali, Fabio [meta:ra/06014]","2017-05","Journal Of Web Semantics [issn:1570-8268 meta:br/06014]","44","","37-53","journal article","Elsevier Bv [crossref:78 meta:ra/06010]",""
"doi:10.1007/978-3-030-00668-6_8 meta:br/0607","The SPAR Ontologies","Peroni, Silvio [meta:ra/06015]; Shotton, David [meta:ra/06016]","2018","Lecture Notes In Computer Science [meta:br/06018]","","","119-136","book chapter","Springer International Publishing [crossref:297 meta:ra/0602]",""
"doi:10.3233/sw-130121 meta:br/0608","The Collections Ontology: Creating And Handling Collections In OWL 2 DL Frameworks","Ciccarese, Paolo [meta:ra/06017]; Peroni, Silvio [meta:ra/06018]","2014","Semantic Web [issn:1570-0844 meta:br/06019]","5","6","515-529","journal article","Ios Press [crossref:7437 meta:ra/0604]",""
"doi:10.4242/balisagevol3.peroni01 meta:br/0609","Towards Markup Support For Full GODDAGs And Beyond: The EARMARK Approach","Di Iorio, Angelo [meta:ra/06019]; Peroni, Silvio [meta:ra/06020]; Vitali, Fabio [orcid:0000-0002-7562-5203 meta:ra/0607]","","","","","","proceedings article","",""
